{
  "id": "two-phase-mr",
  "name": "Look&MidAir",
  "aliases": [
    "Two-Phase Technique (MR)"
  ],
  "year": 2023,
  "summary": "Eye gaze aims a narrow cone and opening the index finger pre-selects what it covers; the candidates are copied into a list in front of the user, and touching the right copy with the hand selects it, keeping the arm low in the first phase.",
  "howItWorks": "A 2° cone follows the eye gaze. Half-opening the non-dominant index finger shows it and fully opening it pre-selects every object it intersects; closing the hand cancels, and with a single candidate it is selected at once. Otherwise the candidates are copied into a list 60 cm in front of the user, linked to the originals, and the user touches the intended copy with the dominant hand (mid-air). On a HoloLens 2 with 12 participants it took 3.41 s against 9.65 s for the arm raycasting of HoloLens 2 and 4.31 s for the microgesture variant Look&Micro, with lower reported fatigue.",
  "advantages": [],
  "limitations": [],
  "primaryTask": "selection",
  "tasks": [
    "selection"
  ],
  "attributes": {
    "selectionTool": [
      "cone"
    ],
    "toolOrigin": [
      "eye"
    ],
    "motorVisualSpace": [
      "remote"
    ],
    "disambiguation": [
      "manual",
      "progressive"
    ],
    "inputModality": [
      "gaze",
      "hand"
    ],
    "confirmation": [
      "touch"
    ],
    "targetDistance": [
      "far"
    ],
    "handlesOcclusion": [
      "partly"
    ],
    "environment": [
      "ar"
    ]
  },
  "tags": [],
  "publications": [
    {
      "publication": "chaffangeon-2023-twophase",
      "role": "introduced"
    }
  ],
  "relationships": [
    {
      "technique": "raycasting",
      "type": "compared-with",
      "source": "chaffangeon-2023-twophase"
    }
  ],
  "review": {
    "status": "draft",
    "notes": "Corrected in Oct 2026 from the full text (earlier draft from the abstract wrongly described a hand ray). Attributes coded by Claude; not yet reviewed by the team.",
    "uncertain": []
  }
}
