{
  "id": "indirect-stretching",
  "name": "Indirect Stretching",
  "aliases": [
    "Indirect Go-Go"
  ],
  "year": 1997,
  "summary": "Arm extension by buttons: two buttons grow or shrink the virtual arm at a constant rate, giving unlimited reach.",
  "howItWorks": "The virtual hand stays on the line from the user's torso through the physical hand; pressing one button lengthens the virtual arm and another shortens it, at a constant rate, until the hand reaches the object to grab.",
  "advantages": [],
  "limitations": [],
  "primaryTask": "selection",
  "tasks": [
    "selection",
    "manipulation"
  ],
  "attributes": {
    "selectionTool": [
      "point"
    ],
    "toolOrigin": [
      "hand"
    ],
    "toolDof": [
      "3"
    ],
    "cdRatio": [
      "anisomorphic-adaptive"
    ],
    "motorVisualSpace": [
      "offset"
    ],
    "disambiguation": [
      "none"
    ],
    "inputModality": [
      "controller"
    ],
    "confirmation": [
      "button"
    ],
    "targetDistance": [
      "near",
      "far"
    ],
    "handlesOcclusion": [
      "no"
    ]
  },
  "tags": [],
  "publications": [
    {
      "publication": "legacy-paper-homer",
      "role": "introduced"
    },
    {
      "publication": "bowman-1999-thesis",
      "role": "surveyed",
      "where": "5.3.1"
    }
  ],
  "relationships": [
    {
      "technique": "go-go",
      "type": "related",
      "note": "Arm extension controlled by buttons instead of hand distance."
    },
    {
      "technique": "stretch-go-go",
      "type": "related",
      "note": "From the same paper."
    }
  ],
  "review": {
    "status": "draft",
    "notes": "Added from Bowman's 1999 thesis (Oct 2026). Attributes drafted by Claude from the survey descriptions and the original paper's abstract; not yet checked against the paper.",
    "uncertain": [
      "toolDof",
      "cdRatio"
    ]
  }
}
