{
  "id": "direct-image-plane",
  "name": "Direct image plane",
  "aliases": [],
  "year": 2003,
  "summary": "Screen-normal ray.",
  "howItWorks": "Screen-normal ray. See the survey evidence and associated source for operational details.",
  "advantages": [],
  "limitations": [],
  "primaryTask": "selection",
  "tasks": [
    "selection"
  ],
  "attributes": {
    "selectionTool": [],
    "toolOrigin": [],
    "toolDof": [],
    "cdRatio": [],
    "motorVisualSpace": [],
    "disambiguation": [],
    "inputModality": [],
    "confirmation": [],
    "targetDistance": [],
    "handlesOcclusion": []
  },
  "tags": [
    "Selection",
    "2013 selection survey",
    "Screen-normal ray"
  ],
  "publications": [
    {
      "publication": "seed-argelaguet-2013",
      "role": "surveyed",
      "where": "Table 1, p. 123"
    },
    {
      "publication": "survey2013-ref-53",
      "role": "reference"
    }
  ],
  "relationships": [],
  "review": {
    "status": "migrated",
    "notes": "Imported from the old catalogue. Attributes and year not yet checked against the paper."
  }
}
