{
  "id": "virtual-pads",
  "name": "Virtual pads",
  "aliases": [],
  "year": 2007,
  "summary": "Pointing on a small virtual pad near the hand is mapped to the whole display, decoupling motor and visual space.",
  "howItWorks": "The user moves within a small input plane close to the body. Positions on the pad map to rays or positions across the large display.",
  "advantages": [],
  "limitations": [],
  "primaryTask": "selection",
  "tasks": [
    "selection"
  ],
  "attributes": {
    "selectionTool": [
      "ray"
    ],
    "toolOrigin": [
      "hand"
    ],
    "motorVisualSpace": [
      "offset"
    ],
    "disambiguation": [
      "none"
    ],
    "inputModality": [
      "controller"
    ],
    "confirmation": [
      "button"
    ],
    "targetDistance": [
      "far"
    ],
    "handlesOcclusion": [
      "no"
    ],
    "environment": [
      "projection"
    ]
  },
  "tags": [
    "Selection",
    "2013 selection survey",
    "Decoupled pointing plane"
  ],
  "publications": [
    {
      "publication": "seed-argelaguet-2013",
      "role": "surveyed",
      "where": "Table 1, p. 123"
    },
    {
      "publication": "survey2013-ref-2",
      "role": "reference"
    }
  ],
  "relationships": [],
  "review": {
    "status": "draft",
    "notes": "Attributes drafted by Claude from the technique description and the 2013 survey classification; not yet checked against the paper.",
    "uncertain": [
      "selectionTool",
      "motorVisualSpace"
    ]
  }
}
